{
  "schema_version": 1,
  "receipt_id": "capture-receipt:10000000-0000-4000-8000-000000000002",
  "closure_id": "closure:10000000-0000-4000-8000-000000000001",
  "closure_digest": "61d1d257e1a5ae61c52f43b820f5ca69561b9303da2c669a6930a6535daad3b7",
  "project_id": "v2-fixture",
  "generated_at": "2026-07-24T00:00:01Z",
  "execution_mode": "fixture_only",
  "status": "validated",
  "redaction_status": "pass",
  "candidate_counts": {
    "decisions": 1,
    "evidence": 1,
    "open_tasks": 1,
    "questions": 1,
    "global_candidates": 1
  },
  "reason_codes": [
    "SCHEMA_VALID",
    "PRIVACY_VALID",
    "NO_WRITE_AUTHORITY"
  ],
  "write_authority": "none",
  "global_write_committed": false
}
